{
  "summary": {
    "total": 1,
    "byPriority": {
      "P2": 1
    },
    "byType": {
      "PERF": 1
    },
    "urgent": 1
  },
  "todos": [
    {
      "priority": "P2",
      "type": "PERF",
      "description": "next.config.ts - 實現 Next.js 15 性能優化配置",
      "details": [
        "問題：未充分利用 Next.js 15 的性能優化特性",
        "影響：圖片載入性能差、bundle 大小過大",
        "建議：",
        "1) 啟用 optimizePackageImports 減少 bundle 大小",
        "2) 配置 bundlePagesRouterDependencies 優化依賴打包",
        "3) 添加 experimental.turbo 配置提升開發體驗",
        "4) 配置適當的圖片優化參數"
      ],
      "file": "next.config.ts",
      "line": 16,
      "assignee": "performance",
      "deadline": "2025-02-01",
      "context": "    esmExternals: true,\n  },\n  \n  // TODO: [P2] PERF next.config.ts - 實現 Next.js 15 性能優化配置\n  // 問題：未充分利用 Next.js 15 的性能優化特性\n  // 影響：圖片載入性能差、bundle 大小過大\n  // 建議：\n  // 1) 啟用 optimizePackageImports 減少 bundle 大小\n  // 2) 配置 bundlePagesRouterDependencies 優化依賴打包\n  // 3) 添加 experimental.turbo 配置提升開發體驗\n  // 4) 配置適當的圖片優化參數\n  // @assignee performance-team\n  // @deadline 2025-02-01"
    }
  ],
  "aiInstructions": "# AI Agent 工作指令\n## 📊 專案狀態\n- 總 TODO 數量: 1\n- 🔴 緊急項目: 1\n## ⚠️ 立即處理（P0 或已過期）\n### 1. PERF: next.config.ts - 實現 Next.js 15 性能優化配置\n- 檔案: `next.config.ts:16`\n- 優先級: P2\n- ⏰ 截止日期: 2025-02-01\n- 負責人: @performance\n**詳細說明:**\n- 問題：未充分利用 Next.js 15 的性能優化特性\n- 影響：圖片載入性能差、bundle 大小過大\n- 建議：\n- 1) 啟用 optimizePackageImports 減少 bundle 大小\n- 2) 配置 bundlePagesRouterDependencies 優化依賴打包\n- 3) 添加 experimental.turbo 配置提升開發體驗\n- 4) 配置適當的圖片優化參數\n**程式碼上下文:**\n```typescript\n    esmExternals: true,\n  },\n  \n  // TODO: [P2] PERF next.config.ts - 實現 Next.js 15 性能優化配置\n  // 問題：未充分利用 Next.js 15 的性能優化特性\n  // 影響：圖片載入性能差、bundle 大小過大\n  // 建議：\n  // 1) 啟用 optimizePackageImports 減少 bundle 大小\n  // 2) 配置 bundlePagesRouterDependencies 優化依賴打包\n  // 3) 添加 experimental.turbo 配置提升開發體驗\n  // 4) 配置適當的圖片優化參數\n  // @assignee performance-team\n  // @deadline 2025-02-01\n```\n## 📋 建議處理順序\n依照以下順序處理 TODO：\n1. P0 - SECURITY（安全性問題）\n2. P0 - FIX（緊急修復）\n3. P1 - SECURITY\n4. P1 - FIX\n5. P1 - FEAT（重要功能）\n6. P2 項目\n7. P3 項目"
}